{
  "ma": "LC-04",
  "ten": "Lan can chữ U (chạy quanh 3 cạnh) — cột 2 góc dùng chung",
  "nhom": "lan_can",
  "phien_ban": 1,
  "trang_thai": "nhap",
  "dau_vao": [
    { "ten": "L1", "nhan": "Cạnh trái", "don_vi": "m" },
    { "ten": "L2", "nhan": "Cạnh giữa (mặt trước)", "don_vi": "m" },
    { "ten": "L3", "nhan": "Cạnh phải", "don_vi": "m" },
    { "ten": "H", "nhan": "Chiều cao lan can", "don_vi": "m", "mac_dinh": 0.9 }
  ],
  "hang_so": {
    "kc_cot_max":  { "gia_tri": 2200, "don_vi": "mm", "cho_chot": true },
    "w_cot":       { "gia_tri": 50,   "don_vi": "mm", "cho_chot": true },
    "w_do":        { "gia_tri": 14,   "don_vi": "mm", "cho_chot": true },
    "khe_do_max":  { "gia_tri": 100,  "don_vi": "mm", "cho_chot": true },
    "cao_tay_vin": { "gia_tri": 80,   "don_vi": "mm", "cho_chot": true },
    "cao_thanh_de":{ "gia_tri": 50,   "don_vi": "mm", "cho_chot": true }
  },
  "bien": [
    { "ten": "kh1", "cong_thuc": "max(1, ceil(L1*1000 / kc_cot_max))" },
    { "ten": "kh2", "cong_thuc": "max(1, ceil(L2*1000 / kc_cot_max))" },
    { "ten": "kh3", "cong_thuc": "max(1, ceil(L3*1000 / kc_cot_max))" },
    { "ten": "so_cot", "cong_thuc": "kh1 + kh2 + kh3 + 1" },
    { "ten": "khoang1", "cong_thuc": "(L1*1000 - (kh1+1)*w_cot) / kh1" },
    { "ten": "khoang2", "cong_thuc": "(L2*1000 - (kh2+1)*w_cot) / kh2" },
    { "ten": "khoang3", "cong_thuc": "(L3*1000 - (kh3+1)*w_cot) / kh3" },
    { "ten": "dai_do", "cong_thuc": "H*1000 - cao_tay_vin - cao_thanh_de" }
  ],
  "chia_khoang": [
    { "ten": "do1", "usable": "khoang1", "be_rong_thanh": "w_do", "khe_toi_da": "khe_do_max" },
    { "ten": "do2", "usable": "khoang2", "be_rong_thanh": "w_do", "khe_toi_da": "khe_do_max" },
    { "ten": "do3", "usable": "khoang3", "be_rong_thanh": "w_do", "khe_toi_da": "khe_do_max" }
  ],
  "ket_qua_phu": [
    { "ten": "so_cot", "nhan": "Tổng cột (2 cột góc dùng chung)", "don_vi": "cột" }
  ],
  "chi_tiet": [
    { "ten": "Cột trụ", "quy_cach": "hộp 50x50 // TẠM", "sl": "so_cot", "dai": "H*1000" },
    { "ten": "Tay vịn + đế cạnh trái", "quy_cach": "theo mẫu", "sl": "2", "dai": "L1*1000",
      "cat_vat": "đầu góc vát 45°" },
    { "ten": "Tay vịn + đế cạnh giữa", "quy_cach": "theo mẫu", "sl": "2", "dai": "L2*1000",
      "cat_vat": "vát 45° hai đầu" },
    { "ten": "Tay vịn + đế cạnh phải", "quy_cach": "theo mẫu", "sl": "2", "dai": "L3*1000",
      "cat_vat": "đầu góc vát 45°" },
    { "ten": "Đố cạnh trái", "quy_cach": "hộp 14x14 // TẠM", "sl": "do1_n * kh1", "dai": "dai_do" },
    { "ten": "Đố cạnh giữa", "quy_cach": "hộp 14x14 // TẠM", "sl": "do2_n * kh2", "dai": "dai_do" },
    { "ten": "Đố cạnh phải", "quy_cach": "hộp 14x14 // TẠM", "sl": "do3_n * kh3", "dai": "dai_do" }
  ],
  "audit": { "ngay": "13/07/2026", "nguoi": "Claude (agent)",
    "ket_qua": "ĐẠT — test số tính tay như LC-03, 2 cột góc trừ trùng đúng. Hằng số TẠM." }
}
