{
  "ma": "SH-02",
  "ten": "Bông cửa sổ nan đứng + hoa góc lập là uốn (mỹ thuật)",
  "nhom": "sen_hoa",
  "phien_ban": 1,
  "trang_thai": "nhap",
  "dau_vao": [
    { "ten": "W", "nhan": "Rộng ô cửa (lọt lòng tường)", "don_vi": "mm", "mac_dinh": 1200 },
    { "ten": "H", "nhan": "Cao ô cửa (lọt lòng tường)", "don_vi": "mm", "mac_dinh": 1400 },
    { "ten": "so_bo", "nhan": "Số bộ giống nhau", "don_vi": "so_luong", "mac_dinh": 1 }
  ],
  "hang_so": {
    "w_khung": { "gia_tri": 20,  "don_vi": "mm", "cho_chot": true },
    "w_nan":   { "gia_tri": 14,  "don_vi": "mm", "cho_chot": true },
    "khe_max": { "gia_tri": 100, "don_vi": "mm", "cho_chot": true },
    "dai_la_hoa": { "gia_tri": 400, "don_vi": "mm", "cho_chot": true }
  },
  "bien": [
    { "ten": "tW", "cong_thuc": "W - 2*w_khung" },
    { "ten": "tH", "cong_thuc": "H - 2*w_khung" }
  ],
  "chia_khoang": [
    { "ten": "nan", "usable": "tW", "be_rong_thanh": "w_nan", "khe_toi_da": "khe_max" }
  ],
  "chi_tiet": [
    { "ten": "Khung bao ngang", "quy_cach": "hộp 20x20 // TẠM", "sl": "2*so_bo", "dai": "W" },
    { "ten": "Khung bao đứng", "quy_cach": "hộp 20x20 // TẠM", "sl": "2*so_bo", "dai": "H" },
    { "ten": "Nan đứng", "quy_cach": "hộp 14x14 // TẠM", "sl": "nan_n*so_bo", "dai": "tH" },
    { "ten": "Hoa góc lập là uốn (4 góc)", "quy_cach": "lập là 20x3 // TẠM",
      "sl": "4*so_bo", "dai": "dai_la_hoa",
      "ghi_chu": "Phôi lập là ~400mm/cụm uốn tay — kiểu dáng theo mẫu xưởng, đổi dài phôi trong ⚙ Tùy chỉnh" }
  ],
  "audit": { "ngay": "13/07/2026", "nguoi": "Claude (agent)",
    "ket_qua": "ĐẠT — nan đối chiếu ENGINE.senHoaNan; hoa góc đếm cụm phôi TẠM 400mm. Kiểu 'sắt mỹ thuật lập là uốn' theo khảo sát 13/07." }
}
