{
  "ma": "LC-01",
  "ten": "Lan can ban công thẳng, đố đứng",
  "nhom": "lan_can",
  "phien_ban": 1,
  "trang_thai": "nhap",
  "dau_vao": [
    { "ten": "L", "nhan": "Chiều dài lan can", "don_vi": "m" },
    { "ten": "H", "nhan": "Chiều cao lan can", "don_vi": "m", "mac_dinh": 0.9 }
  ],
  "hang_so": {
    "kc_cot_max":  { "gia_tri": 2200, "don_vi": "mm", "cho_chot": true },
    "w_cot":       { "gia_tri": 50,   "don_vi": "mm", "cho_chot": true },
    "w_do":        { "gia_tri": 14,   "don_vi": "mm", "cho_chot": true },
    "khe_do_max":  { "gia_tri": 100,  "don_vi": "mm", "cho_chot": true },
    "cao_tay_vin": { "gia_tri": 80,   "don_vi": "mm", "cho_chot": true },
    "cao_thanh_de":{ "gia_tri": 50,   "don_vi": "mm", "cho_chot": true }
  },
  "bien": [
    { "ten": "so_khoang", "cong_thuc": "max(1, ceil(L*1000/kc_cot_max))" },
    { "ten": "so_cot", "cong_thuc": "so_khoang + 1" },
    { "ten": "tong_do", "cong_thuc": "do_moi_khoang_n * so_khoang" }
  ],
  "chia_khoang": [
    { "ten": "do_moi_khoang",
      "usable": "(L*1000 - so_cot*w_cot) / so_khoang",
      "be_rong_thanh": "w_do", "khe_toi_da": "khe_do_max" }
  ],
  "chi_tiet": [
    { "ten": "Cột trụ", "quy_cach": "hộp 50x50", "sl": "so_cot", "dai": "H*1000" },
    { "ten": "Tay vịn + thanh đế", "quy_cach": "theo mẫu", "sl": "2", "dai": "L*1000" },
    { "ten": "Đố đứng", "quy_cach": "hộp 14x14", "sl": "tong_do",
      "dai": "H*1000 - cao_tay_vin - cao_thanh_de" }
  ],
  "audit": { "ngay": "11/07/2026", "nguoi": "Claude (agent)",
    "ket_qua": "ĐẠT checklist A/B/E qua bộ nạp + 3 bộ test đối chiếu engine (chuẩn 6x0.9, lẻ 4.37x1.02, biên 0.5x0.35). C/D không áp dụng. GIỮ NHÃN NHÁP: 6 hằng số TẠM chờ chốt; câu hỏi B3 treo — đố chia theo TỪNG khoang (đang làm) hay chia suốt chiều dài, chờ chủ dự án xác nhận thói quen thợ." }
}
